<?xml version="1.0" encoding="UTF-8"?><aircraft xmlns:xsi="http://www.w3.org/2001/XMLSchema-instance" xsi:noNamespaceSchemaLocation="C:\ChrisWork\sourceRoot\Project\Other\PerformanceComparison\schemas\aircraft.xsd"><details><type>P-38L</type><fuel unit="gallon">0</fuel></details><performance><speed wep="off" altUnit="feet" tasUnit="mph"><smeasure><altitude>0</altitude><tas>339</tas></smeasure><smeasure><altitude>25111</altitude><tas>401</tas></smeasure><smeasure><altitude>28555</altitude><tas>398</tas></smeasure><smeasure><altitude>30000</altitude><tas>395</tas></smeasure></speed><speed wep="on" altUnit="feet" tasUnit="mph"><smeasure><altitude>0</altitude><tas>344</tas></smeasure><smeasure><altitude>2333</altitude><tas>350</tas></smeasure><smeasure><altitude>4111</altitude><tas>357</tas></smeasure><smeasure><altitude>5222</altitude><tas>358</tas></smeasure><smeasure><altitude>6556</altitude><tas>364</tas></smeasure><smeasure><altitude>8444</altitude><tas>368</tas></smeasure><smeasure><altitude>9778</altitude><tas>374</tas></smeasure><smeasure><altitude>12889</altitude><tas>381</tas></smeasure><smeasure><altitude>14000</altitude><tas>383</tas></smeasure><smeasure><altitude>15000</altitude><tas>388</tas></smeasure><smeasure><altitude>20000</altitude><tas>403</tas></smeasure><smeasure><altitude>21110</altitude><tas>405</tas></smeasure><smeasure><altitude>24478</altitude><tas>416</tas></smeasure><smeasure><altitude>26222</altitude><tas>417</tas></smeasure><smeasure><altitude>28222</altitude><tas>411</tas></smeasure><smeasure><altitude>30000</altitude><tas>403</tas></smeasure></speed><climb wep="off" altUnit="feet" rateUnit="fpm"><cmeasure><altitude>0</altitude><rate>3204</rate></cmeasure><cmeasure><altitude>3778</altitude><rate>3170</rate></cmeasure><cmeasure><altitude>8222</altitude><rate>3118</rate></cmeasure><cmeasure><altitude>11000</altitude><rate>3034</rate></cmeasure><cmeasure><altitude>16000</altitude><rate>2797</rate></cmeasure><cmeasure><altitude>21555</altitude><rate>2526</rate></cmeasure><cmeasure><altitude>26000</altitude><rate>2221</rate></cmeasure><cmeasure><altitude>30000</altitude><rate>1678</rate></cmeasure></climb><climb wep="on" altUnit="feet" rateUnit="fpm"><cmeasure><altitude>0</altitude><rate>3746</rate></cmeasure><cmeasure><altitude>3667</altitude><rate>3695</rate></cmeasure><cmeasure><altitude>6444</altitude><rate>3644</rate></cmeasure><cmeasure><altitude>10111</altitude><rate>3509</rate></cmeasure><cmeasure><altitude>16889</altitude><rate>3102</rate></cmeasure><cmeasure><altitude>19555</altitude><rate>2932</rate></cmeasure><cmeasure><altitude>21555</altitude><rate>2729</rate></cmeasure><cmeasure><altitude>26000</altitude><rate>2221</rate></cmeasure><cmeasure><altitude>30000</altitude><rate>1678</rate></cmeasure></climb><turn><turnData flapPosition="none"><speed>185.00</speed><time>19.00</time><sustainedTurnRate>18.9</sustainedTurnRate><sustainedTurnRadius>820</sustainedTurnRadius><stallSpeed>107</stallSpeed><cornerVelocity>263</cornerVelocity><turnRateAtCorner>28.2</turnRateAtCorner><turnRadiusAtCorner>783</turnRadiusAtCorner></turnData><turnData flapPosition="full"><speed>144.00</speed><time>17.8</time><sustainedTurnRate>20.2</sustainedTurnRate><sustainedTurnRadius>598</sustainedTurnRadius><stallSpeed>91</stallSpeed><cornerVelocity>222</cornerVelocity><turnRateAtCorner>33.5</turnRateAtCorner><turnRadiusAtCorner>557</turnRadiusAtCorner></turnData></turn></performance></aircraft>