<?xml version="1.0" encoding="UTF-8"?>
<aircraft xmlns:xsi="http://www.w3.org/2001/XMLSchema-instance" xsi:noNamespaceSchemaLocation="C:\ChrisWork\sourceRoot\Project\Other\PerformanceComparison\schemas\aircraft.xsd">
	<details>
		<type>P51-B</type>
		<fuel unit="gallon">0</fuel>
	</details>
	<performance>
		<speed wep="off" altUnit="feet" tasUnit="mph">
			<smeasure>
				<altitude>0</altitude>
				<tas>349</tas>
			</smeasure>
			<smeasure>
				<altitude>1556</altitude>
				<tas>354</tas>
			</smeasure>
			<smeasure>
				<altitude>17111</altitude>
				<tas>424</tas>
			</smeasure>
			<smeasure>
				<altitude>23778</altitude>
				<tas>411</tas>
			</smeasure>
			<smeasure>
				<altitude>30000</altitude>
				<tas>439</tas>
			</smeasure>
		</speed>
		<speed wep="on" altUnit="feet" tasUnit="mph">
			<smeasure>
				<altitude>0</altitude>
				<tas>360</tas>
			</smeasure>
			<smeasure>
				<altitude>16111</altitude>
				<tas>425</tas>
			</smeasure>
			<smeasure>
				<altitude>21889</altitude>
				<tas>415</tas>
			</smeasure>
			<smeasure>
				<altitude>22889</altitude>
				<tas>418</tas>
			</smeasure>
			<smeasure>
				<altitude>25778</altitude>
				<tas>430</tas>
			</smeasure>
			<smeasure>
				<altitude>28889</altitude>
				<tas>445</tas>
			</smeasure>
			<smeasure>
				<altitude>30000</altitude>
				<tas>442</tas>
			</smeasure>
		</speed>
		<climb wep="off" altUnit="feet" rateUnit="fpm">
			<cmeasure>
				<altitude>0</altitude>
				<rate>2900</rate>
			</cmeasure>
			<cmeasure>
				<altitude>15780</altitude>
				<rate>3185</rate>
			</cmeasure>
			<cmeasure>
				<altitude>21780</altitude>
				<rate>2539</rate>
			</cmeasure>
			<cmeasure>
				<altitude>26670</altitude>
				<rate>2422</rate>
			</cmeasure>
			<cmeasure>
				<altitude>27780</altitude>
				<rate>2422</rate>
			</cmeasure>
			<cmeasure>
				<altitude>30000</altitude>
				<rate>2030</rate>
			</cmeasure>
		</climb>
		<climb wep="on" altUnit="feet" rateUnit="fpm">
			<cmeasure>
				<altitude>0</altitude>
				<rate>3175</rate>
			</cmeasure>
			<cmeasure>
				<altitude>14222</altitude>
				<rate>3408</rate>
			</cmeasure>
			<cmeasure>
				<altitude>18889</altitude>
				<rate>2857</rate>
			</cmeasure>
			<cmeasure>
				<altitude>26222</altitude>
				<rate>2708</rate>
			</cmeasure>
			<cmeasure>
				<altitude>30000</altitude>
				<rate>2030</rate>
			</cmeasure>
		</climb>
    <turn>
      <turnData flapPosition="none">
        <radius>233.42</radius>
        <degPerSec>17.70</degPerSec>
        <speed>162.00</speed>
        <time>21.33</time>
      </turnData>
      <turnData flapPosition="full">
        <radius>182.21</radius>
        <degPerSec>16.20</degPerSec>
        <speed>116.00</speed>
        <time>22.16</time>
      </turnData>
    </turn>
	</performance>
</aircraft>
